{
  "$schema": "http://json-schema.org/draft-07/schema#",
  "title": "FIBO Scene",
  "type": "object",
  "properties": {
    "scene": {"type":"object"},
    "camera": {"type":"object"},
    "lighting": {"type":"object"},
    "controlnet": {"type":"object"},
    "post_process": {"type":"object"}
  },
  "required":["scene","camera"]
}
